user,text,created_at_datetime,link,comments,retweets,likes,quotes
@grubbshowmedia,"Climate Change is a natural phenomenon that has occurred throughout Earth's history&#44; independent of human activity. Here's how these natural cycles work:  1. Orbital Variations (Milankovitch Cycles):    - Earth's orbit around the Sun changes in shape (eccentricity)&#44; its tilt (obliquity) varies&#44; and the direction of its axis (precession) shifts over long periods. These cycles alter the distribution and intensity of solar energy received by different parts of the Earth&#44; leading to climate shifts over tens of thousands to hundreds of thousands of years. For instance&#44; these cycles are known to have played a significant role in the coming and going of ice ages.  2. Solar Radiation Changes:    - The Sun's output is not constant; it goes through cycles of higher and lower activity&#44; including sunspot cycles that last about 11 years. Over longer timescales&#44; there are periods of significantly increased or decreased solar output&#44; like the Maunder Minimum&#44; which coincided with a period known as the Little Ice Age in Europe.  3. Volcanic Eruptions:    - Large volcanic eruptions can inject massive amounts of aerosols into the stratosphere&#44; which can cool the Earth temporarily by reflecting sunlight back into space. The 1815 eruption of Mount Tambora&#44; for example&#44; led to the ""Year Without a Summer"" in 1816&#44; where global temperatures dropped significantly.  4. Ocean Currents:    - Changes in ocean circulation patterns&#44; like the El Niño-Southern Oscillation (ENSO)&#44; can cause regional climate variations. These can shift weather patterns&#44; leading to prolonged periods of drought or heavy rainfall in different parts of the world. Over longer geological timescales&#44; changes in ocean currents have been linked to significant climate shifts.  5. Plate Tectonics:    - The movement of continents affects ocean currents&#44; atmospheric circulation patterns&#44; and the distribution of landmasses relative to the poles or equator. For example&#44; when all continents were joined in Pangaea&#44; the climate was different than when they were dispersed as they are now.   6. Atmospheric Composition:    - Over geological time&#44; the composition of Earth's atmosphere has changed due to biological activity and geological processes. For instance&#44; the rise of oxygen levels due to photosynthesis fundamentally altered the planet's climate and life forms.  7. Greenhouse Gases from Natural Sources:    - Even without human influence&#44; natural processes release greenhouse gases. Methane emissions from wetlands&#44; carbon dioxide from volcanic activity&#44; and nitrous oxide from soil bacteria all contribute to the greenhouse effect&#44; influencing temperature.  Discussion:  The natural cycles of climate change are complex and occur over various timescales&#44; from decades to millions of years. They show that Earth's climate is inherently dynamic. While these natural forces can lead to significant changes in climate&#44; the current rapid rate of change is largely attributed to human activities&#44; particularly the burning of fossil fuels which has spiked levels of carbon dioxide and other greenhouse gases beyond what natural cycles would suggest.  Understanding these natural mechanisms doesn't negate human impact but provides a backdrop for how Earth's climate has evolved. It's crucial in climate science to distinguish between what is natural variability and what is anthropogenic change&#44; as this informs policy&#44; adaptation strategies&#44; and mitigation efforts. The interplay between natural cycles and human-induced changes makes the study of climate change a continuously evolving field&#44; with each discovery adding to our understanding of this intricate system.",2025-01-13T23:35:00Z,/grubbshowmedia/status/1878949045756146095#m,0,0,0,0
@OrionGarrett,Snow Northeast&#44; Cold in the east rain in the southeast and drought in the west is climate Change IE weather cycles not manmade Carbon issues. California policies caused 50 years of manmade air pollution with this fire. Natural Gas&#44; Nuclear Energy and yes Oil drilled everywhere go,2025-01-13T20:38:00Z,/OrionGarrett/status/1878904369003057286#m,0,1,0,0
@idummkopp,I wish everybody would stop talking about preindustrial natural climate cycles. They are not relevant for understanding what caused the current climate change. We need to prioritize action over historical debate.  The causes of current climate change are no longer in question&#44; and focusing on pre-industrial climate variability does not contribute to reducing emissions&#44; implementing renewable energy solutions&#44; or protecting vulnerable communities from the impacts of a warming planet.,2025-01-12T19:31:00Z,/idummkopp/status/1878525287480049983#m,0,0,0,0
@journey_le29533,"Cue the ""Climate Change"" shills blaming the L.A. fires on fake sciencepropaganda Our Climate is changing&#44; but the prime driver are natural cosmic/Earth cycles (the Sun)&#44;not humans Blaming humans allows more government control and more tax money to be taken from the human slaves",2025-01-08T20:46:00Z,/journey_le29533/status/1877094435055395209#m,0,0,0,0
@ButchArnold1,"Cue the ""Climate Change"" shills blaming the L.A. fires on fake science propaganda   Our Climate is changing&#44; but the prime driver are natural cosmic/Earth cycles (the Sun)&#44; not humans  Blaming humans allows more government control and more tax money to be taken from the human slaves",2025-01-08T19:45:00Z,/ButchArnold1/status/1877079114949026061#m,0,0,0,0
@BandOfBrothersQ,"Cue the ""Climate Change"" shills blaming the L.A. fires on fake science propaganda   Our Climate is changing&#44; but the prime driver are natural cosmic/Earth cycles (the Sun)&#44; not humans  Blaming humans allows more government control and more tax money to be taken from the human slaves",2025-01-08T18:27:00Z,/BandOfBrothersQ/status/1877059472574787914#m,0,0,2,0
@Grouperguy22,"Cue the ""Climate Change"" shills blaming the L.A. fires on fake science propaganda  Our Climate is changing&#44; but the prime driver are natural cosmic/Earth cycles (the Sun)&#44; not humans Blaming humans allows more government control & more tax money to be taken from the human slaves!",2025-01-08T17:46:00Z,/Grouperguy22/status/1877049368454508736#m,0,0,0,0
@Jordan_Sather_,"Cue the ""Climate Change"" shills blaming the L.A. fires on fake science propaganda  Our Climate is changing&#44; but the prime driver are natural cosmic/Earth cycles (the Sun)&#44; not humans  Blaming humans allows more govt control and more tax money to be taken from the human slaves",2025-01-08T16:52:00Z,/Jordan_Sather_/status/1877035753626083670#m,10,65,182,5
@Jordan_Sather_,1) The climate is changing&#44; but it’s not being caused by humans (natural cosmic cycles)  2) Fires are so bad in California due to forest and reservoir mismanagement  3) Gotta wonder if arson was involved in this,2025-01-08T15:29:00Z,/Jordan_Sather_/status/1877014748098695237#m,20,47,183,1
@climatederange,Earth’s climate has always fluctuated. The Medieval Warm Period (950-1250 AD) had temperatures similar to today&#44; driven by natural cycles like solar activity—not CO2. What caused warming then if not industrialization? 🌍 #ClimateScam,2024-12-30T17:32:00Z,/climatederange/status/1873784265252757690#m,0,0,0,0
@Barkum68,Exactly. Climate change is a natural process that has been happening for billions of years. It is not caused by humans&#44; but by the Sun&#44; cosmic rays and the earth itself. So don't let the government and that snake that is the media 🐍 fool you.,2024-12-29T20:11:00Z,/Barkum68/status/1873461917530083709#m,1,1,8,0
@climatederange,If climate science were settled&#44; then natural factors like solar cycles&#44; volcanic activity&#44; and ocean currents wouldn’t be in the back seat.  The Sun’s activity has a significant impact on Earth’s climate but is often downplayed in favor of monetized CO2 narratives. #ClimateScam,2024-12-28T16:20:00Z,/climatederange/status/1873041222341947454#m,1,1,0,0
@HariSel36110771,Lost me when you start blaming climate change like it isn’t something the world has done since the dawn of time. We’ve had ice ages&#44; heat waves&#44; mini-ice ages and more. Humans have a minuscule impact as compared to natural cycles&#44; the sun and the like.,2024-12-21T16:59:00Z,/HariSel36110771/status/1870514365054791691#m,0,0,0,0
@GerardAMorrow,Climate changes all the time&#44; so it can't be a hoax. The Earth warms and cools cyclically through natural causes&#44; the main one being pulled further from the Sun and pushed nearer to the Sun over around 1000 year cycles. 1000 years ago the the World was as warm&#44; or warmer than today with a much smaller global population and not a single petrol engine on the planet. So climate change isn't a hoax&#44; and humans contributing to it isn't a hoax. Using the output of computer models&#44; of a chaotic&#44; non-linear system&#44; and pretending to be able to forecast catastrophes is a hoax.  Which is why there are no scientific organisations forecasting future catastrophes.,2024-12-06T08:52:00Z,/GerardAMorrow/status/1864956135737884858#m,0,0,0,0
@Harry_Lippitz,Climate change is a natural and progressive change.  For the past year our own sun has been going through changes; not caused by cow farts  Our climate has been hotter and it has been colder&#44; all within the past 2000 years  In 1970 we were all going to freeze&#44; according to media!,2024-12-05T15:12:00Z,/Harry_Lippitz/status/1864689308923228617#m,1,0,2,0
@WilliamPar60374,The Climate Change HOAX is being exposed!  Spoiler Alert: Carbon Dioxide is not causing the Earth to warm.    Climate Change is natural.   Ice Ages come and go.  Sun activity cycles.  We don’t need to give Trillions to grifters like John Kerry & Al Gore.   Time to wake up.,2024-11-28T04:52:00Z,/WilliamPar60374/status/1861996633388470708#m,0,0,0,0
@risucci_rick,Yes Climate Change has nothing to do with people or its use of natural resources & fossil fuels. It is 100% caused by the sun & its proximatety to the earth. The climate changes in all parts of the world in periods of time over the solar systems known existance. Scientists will never know more than their creator.,2024-11-24T14:01:00Z,/risucci_rick/status/1860685130722865200#m,0,0,0,0
@FilozofA,"That was known in 19th century to Milutin Milanković! He explained the Earth's long-term climate changes as caused by changes in the position of the Earth in comparison to the Sun&#44; now known as ""Milankovitch cycles"".",2024-11-18T17:10:00Z,/FilozofA/status/1858558512324112411#m,0,1,1,0
,,,,0,0,0,0
@klaurson,We need underground space on earth as well - earth goes through uninhabitable cycles caused by meteorites&#44; super volcanos&#44; sun flares&#44; rapid climate change etc. It is good to be prepared and have somewhere to hide for a few years.,2024-11-14T00:34:00Z,/klaurson/status/1856858183341404275#m,0,0,0,0
@PeterDClack,Weather patterns & cycles of warming or cooling are not caused by carbon dioxide. They come from the sun&#44; which is 99.85 the mass of the solar system & controls all light & energy. The climate campaign exploits fear & falsified data to create an environmental crisis.,2024-11-13T22:46:00Z,/PeterDClack/status/1856830989177098692#m,90,"1,262","2,617",68
@GoSavageGIRLs,This is interesting because people forget they recently came out of caves and the climate isn’t changing&#44; they haven’t genetically experienced the Planets natural cycles and quite possibly have a sun allergy  This study tells me cave people should remain in caves,2024-10-22T07:03:00Z,/GoSavageGIRLs/status/1848621257857601998#m,0,0,0,0
@QuinctiusCinCin,If we want UK Plc to survive and for its citizens to maintain a decent standard of living &#44; the false narrative that climate change is caused by manmade CO2 must  be eviscerated. Climate change is a natural phenomenon influenced by the sun&#44; seas&#44; clouds & air streams.,2024-10-04T09:32:00Z,/QuinctiusCinCin/status/1842135634032447552#m,0,5,9,0
@blee0118,"Is climate change real&#44; absolutely? Do natural things like volcanos and the sun affect the climate&#44; absolutely? Does the Earth go through climate cycles&#44; cold and warm?  Absolutely.  Can man affect the climate? Maybe. There is not enough evidence that supports that ""man theory""",2024-10-02T21:50:00Z,/blee0118/status/1841596722734367184#m,1,0,0,0
@blee0118,Each and every time we have a natural disaster&#44; the Climate alarmists come out. Does the climate change? absolutely&#44; no doubt.  Does it run it cycles maybe.  Do natural things affect it&#44; like volcanos or the sun&#44; absolutely.  Can Man do anything about it?  Absolutely NOT.,2024-09-30T16:12:00Z,/blee0118/status/1840786772445323599#m,0,0,0,0
@ERINBROPHY18,CO2 is the basis of all life on Earth&#44; the Sun&#44; and it's cycles&#44; rules over the temperature fluctuations on our planet&#44; cow farts are part of the natural carbon cycle and completely devoid of harm to Mother Earth...  man made climate change is an absolute farce....,2024-09-27T02:23:00Z,/ERINBROPHY18/status/1839490907545960707#m,0,0,1,0
@Sabrina_4083,I think a lot of people misunderstand the climate change/global warming issue. The earth goes through natural cycles of warming and cooling. Currently we are going through a warming cycle&#44; it's totally natural&#44; BUT!!!!!!!!! human activity has caused this cycle to happen faster and more severe than it normally would. Yes&#44; all the things the scientists say are bad for the planet are bad for the planet. Don't let the greed of companies lie to you. Don't let the sarcasm of politicians to sway you. Look beyond and think for yourself. #OneWorld,2024-09-25T14:31:00Z,/Sabrina_4083/status/1838949551866003930#m,0,0,0,0
@JusperMachogu,False! We have the biggest climate body&#44; IPCC&#44; studying human and not natural caused climate change. We don't know enough about the sun & its climate effects + what's happening below the oceans which cover 70% of 🌎. The sun controls our climate  #ClimateScam,2024-09-24T14:13:00Z,/JusperMachogu/status/1838582572814864640#m,0,13,35,0
@BtrClngrUBetcha,Variability of the climate on Earth is part of natural cycles that impact the orbit and tilt of the Earth relative to the Sun. Changes in SOLAR output can have significant impacts here&#44; as in the Maunder Minimum output&#44; which caused the Little Ice Age. space.com/earth-sun-relation…,2024-09-21T01:32:00Z,/BtrClngrUBetcha/status/1837303875419660595#m,0,0,0,0
@Dennis_C_Hayes,The only climate crisis is the one being caused by the government interference in the free enterprise competitive market. There is no climate crisis in nature. The natural cycles of climate are working just fine and that zero is completely unnecessary a waste of money and a misguided that’s doing much more harm than it could ever do good as the planet warm natural causes more Carmada oxide is released into the atmosphere. They’ve got it backwards and they’re not smart enough to admit it.,2024-09-16T11:02:00Z,/Dennis_C_Hayes/status/1835635402494874097#m,0,0,0,0
@samfrob5,Yes. Climate change is a natural climate cycle caused by the sun and the oceans. NOT MANKIND.,2024-09-04T10:16:00Z,/samfrob5/status/1831275157467316396#m,0,0,0,0
@realeatrawmeat,I suspect they're cleaning up El Salvador because of the change in growing and climate zones(fueled by sun and natural cycles)&#44; to make it more hospitable for the NWO.,2024-09-04T01:10:00Z,/realeatrawmeat/status/1831137733911138659#m,1,0,4,0
@BeverlyWendlin1,I do not believe that climate change is caused by humans. We have had like 3 ice ages that froze over the earth and melted again without there being humans on earth. It is natural cycles the planet goes through. Ev's will do nothing to fix the change.,2024-08-31T19:10:00Z,/BeverlyWendlin1/status/1829959893463540064#m,2,0,0,0
@BeverlyWendlin1,Just a thought on climate change. I do not believe that climate change is caused by humans. We have had 2 or 3 ice ages that melted long before there were humans. It is just natural cycles of the earth. Electric cars will not do anything to help it become better or worse.,2024-08-28T17:17:00Z,/BeverlyWendlin1/status/1828844380754719149#m,0,0,0,0
@longliveeurope_,There’s no environmental crisis. You can fit the entire world’s population in Delaware&#44; elbow to elbow.  Humans have zero influence on the climate or environment. It’s the Earth’s natural rhythms and cycles. The sun has more influence. Nope&#44; it's all bs to control us harder.,2024-08-27T07:07:00Z,/longliveeurope_/status/1828328372667326885#m,0,0,0,0
@JamiluJibril8,"Denials vs Climate Change Facts  Denial: ""It's not happening"" Fact: Rising global temps & extreme weather events  Denial: ""It's natural cycles"" Fact: 98% of scientists agree on human-caused climate change  Denial: ""It's too expensive to act"" Fact: Inaction costs more than climate",2024-08-21T18:47:00Z,/JamiluJibril8/status/1826330390853816733#m,0,1,0,0
@JamiluJibril8,"Denials vs Climate Change Facts  - ""Not happening"" vs Rising temps & extreme weather - ""Natural cycles"" vs 98% of scientists agree on human-caused - ""Too expensive"" vs Inaction costs more  #ClimateFacts #DenialVsReality #ActOnClimate #Climatebrawl #ClimateCrisis #ClimateEmergency",2024-08-21T18:41:00Z,/JamiluJibril8/status/1826328784007553387#m,0,0,1,0
@JamiluJibril8,Climate Change Denials: Repainting the Truth  - 98% of scientists agree: human-caused - CO2 levels & temps aren't natural cycles - Inaction is expensive&#44; not climate action  #ClimateFacts #DenialIsNotAnOption #ActOnClimate #Climatebrawl #UN,2024-08-21T13:19:00Z,/JamiluJibril8/status/1826247715518656916#m,0,5,7,0
@maegan_laporte,our education system is a farce when people like this think that climate change causes weather to occur when change is the result of weather patterns over several decades which are caused by the sun and ocean cycles in which none of us has control get a grip,2024-08-17T16:48:00Z,/maegan_laporte/status/1824850858984841521#m,0,1,1,0
,,,,0,0,0,0
@josbourgault,The video below ⬇️ explains in just 6 minutes the science of CO2 variations.    “Climate Change Cycles” explained in the book: INCONVENIENT FACTS are caused by the Milankovitch Cycles (Earth’s predictable variance in its elliptical orbit around the Sun) which can be observed in Antarctic Ice Core Samples Charts dating back to 800&#44;000 years.   CO2 is not a pollutant! CO2 does not cause global warming ! CO2 follows climate changes!,2024-08-05T23:36:00Z,/josbourgault/status/1820604793242386718#m,1,3,5,1
@AstroInsights_,Solar activity changes have some impact on Earth's climate&#44; although most scientists agree that current climate change is primarily driven by human activities rather than natural solar cycles. The Sun has an approximately 11-year activity cycle&#44; with variations in sunspots and solar radiation. During the solar maximum&#44; solar radiation is slightly stronger&#44; while it is weaker during the solar minimum.  Solar radiation&#44; or the solar constant&#44; varies by about 0.1% throughout the cycle. This small change can affect the climate system&#44; particularly when combined with other factors. Ultraviolet (UV) radiation from the Sun also fluctuates during the cycle&#44; impacting the upper atmosphere&#44; especially the stratosphere&#44; and influencing the ozone layer and stratospheric temperature.  Historically&#44; periods of low solar activity&#44; such as the Maunder Minimum (1645–1715)&#44; corresponded with colder climate conditions in Europe and North America&#44; known as the Little Ice Age. Another period&#44; the Dalton Minimum (1790–1830)&#44; also aligned with cooler temperatures.  While solar activity changes have some influence on Earth's climate&#44; they are not the primary driver of modern climate change. Human activities&#44; particularly the emission of greenhouse gases&#44; have a much more significant impact on global temperatures and climate conditions.,2024-07-25T11:51:00Z,/AstroInsights_/status/1816441082898501678#m,0,0,0,0
@JChimirie66677,Milankovitch (Orbital) Cycles and Their Role in Earth’s Climate  Precession – As Earth rotates&#44; it wobbles slightly upon its rotational axis&#44; like a slightly off-center spinning toy top. This wobble is due to tidal forces caused by the gravitational influences of the Sun and Moon that cause Earth to bulge at the equator&#44; affecting its rotation. The trend in the direction of this wobble relative to the fixed positions of stars is known as axial precession. The cycle of axial precession spans about 25&#44;771.5 years.  Axial precession makes seasonal contrasts more extreme in one hemisphere and less extreme in the other. Currently perihelion occurs during winter in the Northern Hemisphere and in summer in the Southern Hemisphere. This makes Southern Hemisphere summers hotter and moderates Northern Hemisphere seasonal variations. But in about 13&#44;000 years&#44; axial precession will cause these conditions to flip&#44; with the Northern Hemisphere seeing more extremes in solar radiation and the Southern Hemisphere experiencing more moderate seasonal variations. science.nasa.gov/science-res…,2024-07-23T18:12:00Z,/JChimirie66677/status/1815812289422831970#m,0,0,1,1
@ann_adam,SORRY to SAY&#44; this 88 yr old THIRD GEN. California born agrees with you. The beautiful range of geography and natural climate cycles WILL still be there after radical left caused collapse happens&#44; THE FASTER those that are willing to invest & work hard will be able to return❣️,2024-07-21T01:59:00Z,/ann_adam/status/1814842697607487966#m,0,0,0,0
@climateadvpak,An essential element of the Earth’s natural bio-chemical cycles&#44; they're also caused in part by human-induced drivers&#44; including climate change&#44; and unsustainable land management and water use. In turn&#44; sand and dust storms contribute to climate change and air pollution.  #SDSDay,2024-07-12T08:02:00Z,/climateadvpak/status/1811672408849285265#m,0,0,1,1
@amfelicite,#InternationalDayofCombatingSandandDustStorms&#44; July 12 #Sandandduststorms =an essential element of the Earth’s natural bio-chemical cycles =caused in part by human-induced drivers&#44;climate change&#44; unsustainable land management&#44; water use&#44; air pollution... @UN #UN @UNEP #UNEP #Sand,2024-07-11T22:01:00Z,/amfelicite/status/1811521095897411630#m,0,0,0,0
@mark_petereit,Was it greenhouse gas emissions that caused the Halocene Optimum? Did unregulated CO2 emissions cause the Minoan warming? The Roman Warming? The Medieval warming?   Or is it possible that’s there are natural global climate cycles that have nothing to do with human activity?,2024-07-06T13:30:00Z,/mark_petereit/status/1809580632558755865#m,0,0,0,0
@cuchovivas,The MAGA understanding of climate change is that changes in the climate are part of the Earth's natural cycles and not primarily caused by human activities. So&#44; Senator&#44; what do you want the federal government to do? Throw ice at it?,2024-06-25T21:11:00Z,/cuchovivas/status/1805710544487285110#m,1,0,3,0
@UltraMAGAMan_,How much does man actually impact climate as opposed to the sun and the earth’s natural heating and cooling cycles? Temperatures were much higher when dinosaurs roamed the planet. We’ve had ice ages long before mankind walked the earth. To what degree is mankind affecting climate,2024-06-18T15:29:00Z,/UltraMAGAMan_/status/1803087586086269186#m,0,0,0,0
@doc_gero,"👇Actually&#44; the systematic study of climate & weather dates back 3000 BC in India. In the Upanishads&#44; apparently&#44; cloud formation&#44; rain&#44; and seasonal cycles caused by the Earth's movement around the sun is discussed & observed.   Aristotle wrote ""Meteorologica"" around 340 BC.",2024-06-13T16:30:00Z,/doc_gero/status/1801290947327909994#m,4,1,14,0
@mlbsquared1,True! We don’t hear about the sun (solar cycles) and natural weather patterns which are the main drivers of “climate change” because if we talk about that people will realize theres nothing to feel guilty about and we don’t need to&#44; and are powerless to&#44; solve it. If the problem goes away it can’t be used by gov/politicians/corps/NGOs/media to control and manipulate folks anymore.,2024-06-12T22:30:00Z,/mlbsquared1/status/1801019289534931059#m,0,0,1,0
@Clarsonimus,#ClimateCrisis Fun Facts: Natural #climate variability consists of various cycles. Some are related to variations in solar luminosity&#44; tidal effects of the Sun and Moon as well as the gravitational and electromagnetic oscillations of the heliosphere due to the revolution of the planets around the Sun. This interplanetary electromagnetic effect also modulates cosmic ray intensity which affects Earth's cloud formation. #CO2 #Fear #Industry,2024-06-12T08:14:00Z,/Clarsonimus/status/1800803837772460226#m,0,3,3,2
@Kvtujo_Lsbof,#climate #change is defintely real. The earth goes through natural climate cycles&#44; relative to the Earth's rotation around the sun&#44; and the moon's rotation around the earth&#44; and other celestial bodies in the solar system. It has nothing to do with humans&#44; CO2 or cow farts.,2024-06-11T21:55:00Z,/Kvtujo_Lsbof/status/1800648101377487273#m,0,0,0,0
@JimMcKay458490,Climate has been changing on earth for 4 billion years&#44; its not caused by 0.04% CO2  becoming 0.041% &#44; it's caused by Climate Cycles do to earth relationship to the sun&#44; and no one on the planet can change these cycles. This is the real science !,2024-06-07T12:14:00Z,/JimMcKay458490/status/1799052311983272316#m,0,0,0,0
