user,text,created_at_datetime,link,comments,retweets,likes,quotes
@Timothy_Cama,Johnson: 'The climate is changing&#44; but the question is&#44; is it being caused by natural cycles over the span of the Earth’s history? Or is it changing because we drive SUVs? I don’t believe in the latter ... I don’t think that’s the primary driver',2023-10-25T17:36:00Z,/Timothy_Cama/status/1717233764450160718#m,0,4,1,0
@billmckibben,Hey&#44; here's next speaker candidate Mike Johnson on the climate crisis: “The climate is changing&#44; but the question is&#44; is it being caused by  natural cycles over the span of the Earth’s history? Or is it changing  because we drive SUVs? I don’t believe in the latter.”,2023-10-25T15:37:00Z,/billmckibben/status/1717203633542939059#m,61,123,340,47
@yellowsnakes7,"anthropogenic climate change does not exist. Climate change is caused by the sun and other natural sources&#44; in case you haven't noticed 🎶🇨🇦☮️ it doesn't take a rocket scientist to figure that out. it takes BOUGHT ""scientists"" to sell you the climate scam",2023-10-17T16:09:00Z,/yellowsnakes7/status/1714312678775349428#m,0,0,0,0
@magicdmw,Geopolitically globalism will end&#44; we are experiencing population collapse all over the world. Climate change is not due to carbon it’s a scam. It is natural variability through the sun & other cycles that affect our climate. Powerful forces are trying to centralise power into global institutions through destabilising the west from within.,2023-10-17T05:36:00Z,/magicdmw/status/1714153387204194491#m,0,0,0,0
@maegan_laporte,Oil doesn’t control the damn climate nor weather the sun and other natural factors do and millions of years ago there was no ice at either pole that was not caused by oil god some people are stupid,2023-10-14T16:28:00Z,/maegan_laporte/status/1713230199515476365#m,0,0,0,0
@angusreidorg,Most Canadians say climate change is a fact. Two-thirds say it's caused by human activities while one-in-five believe it is caused by natural cycles.  angusreid.org/wp-content/upl…,2023-10-11T13:02:00Z,/angusreidorg/status/1712091241049891232#m,2,0,2,0
@philthefish42,Within the natural electrical cycles from the sun&#44; if it isn't heat making the climate change. Then what action/s by man is altering it? I give an explanation with my new page Pointy Things&#44; to go on my site and probably&#44; before Stage Zero's next countdown starts.,2023-10-08T01:29:00Z,/philthefish42/status/1710829738472673403#m,0,0,0,0
@Clarsonimus,#ClimateCrisis fun facts: The Svensmark Mechanism (see cosmoclimatology) is a natural climate fluctuation mechanism caused by cosmic rays associated with changes in the sun's electromagnetic field that have an influence on cloud cover. #CO2 #Fear #Business,2023-10-04T12:04:00Z,/Clarsonimus/status/1709540020535636228#m,3,4,9,0
@LandCruiserLar1,FACT that humankind did not/cannot impact the natural cycles of the Sun. Climate change is a political hoax with no true basis in real science/data. #climatechange #climatechangehoax #notbuyingyourclimatechange #itscalledtheweather and no one has any control over it.,2023-09-19T18:28:00Z,/LandCruiserLar1/status/1704200757094871466#m,0,0,0,0
@DougM52019872,Climate skeptics themselves don’t agree on  how much humans are contributing to global warming by burning fossil  fuels&#44; and how much is caused by natural variability from El Niño and  other cycles that can take centuries to play out.,2023-09-16T11:39:00Z,/DougM52019872/status/1703010837437243556#m,0,0,0,0
@TotSurvivorDad,Fossil Fuels have nothing to do with Climate Change! It's natural every 6&#44;000 to 12&#44;000 year's & caused by the SUN!  9and10news.com/2023/09/12/in…,2023-09-12T18:36:00Z,/TotSurvivorDad/status/1701666133219348744#m,0,0,1,0
@reardongalt,There is no actual evidence that man can affect climate change. It's much bigger than man.  climate.nasa.gov/news/2948/m….  It's a natural process&#44; involving the sun and the Milankovitch cycles&#44; which include:  The shape of Earth's orbit&#44; known as eccentricity; The angle Earth's axis is tilted with respect to Earth's orbital plane&#44; known as obliquity; and. The direction Earth's axis of rotation is pointed&#44; known as precession.,2023-09-10T19:15:00Z,/reardongalt/status/1700951040974336078#m,3,1,3,0
,,,,0,0,0,0
@grose_lord,Climate changes all the time&#44; but even humans like Harry and his family do not affect it!  That is the natural cycles of the earth and it`s journey around the sun`s prerogative!,2023-09-09T16:39:00Z,/grose_lord/status/1700549428816290281#m,2,0,1,0
@ArtofeVan,It may be just as false to blame all these supposed natural disasters on deep state technology as it is to blame false global warming narratives on the activities of man ONLY since 1850. Earth&#44; climate&#44; and nature have many&#44; many causes of which a massive one is Sun cycles.,2023-09-09T00:59:00Z,/ArtofeVan/status/1700312882003451938#m,0,0,0,0
@BeesterGee,#Climate @Lauratobin1 it's not driven by CO2. It's just 0.03% of the atmosphere&#44; of which just 3% is man made. Levels follow don't drive temperature. We're in a natural warming period due to solar cycles. Please realise this & the huge damage that will be caused chasing rainbows,2023-09-07T07:32:00Z,/BeesterGee/status/1699687169164452113#m,1,0,0,0
@tibetanfighting,Hopefully&#44; conscious people will not throw the baby out with the bathwater on this issue&#44; just because dark people want to profit from it. There is a human caused element to our climate issues&#44; alongside the natural cycles. If we do not become aware of this&#44; it could be bad for us all. @DiligentDenizen @Nuni_Sas_Yu @PatJohns80512 @whitematador @earthcase96,2023-09-05T10:42:00Z,/tibetanfighting/status/1699010156703764707#m,0,0,0,0
@pringle_ge6053,Climate change is natural and CO2 is NOT a pollutant but rather is the basis of all plant life. This article covers the REAL FACTS. Weather has always changed&#44; the 1930's worse than now&#44; so were the early 1800's&#44; 1500's. The sun cycles are 99.95% to blame! zerohedge.com/political/over…,2023-08-31T10:13:00Z,/pringle_ge6053/status/1697190813829099682#m,1,1,1,0
@Pres_Wolverine,This whole Climate Change is a bunch of B.S.! Biden has caused this mess&#44; our inflation&#44; our debt&#44; and all the HATE he has generated over an issue that does not exist.  Climate changes in cycles&#44; always has&#44; always will.  It used to it and accept what is natural.,2023-08-30T02:11:00Z,/Pres_Wolverine/status/1696707153330086178#m,0,0,1,0
@tim_dunkerton,There’s no climate crisis&#44; but a real energy crisis caused by those who accept the narrative that human emissions of carbon dioxide cause global warming when&#44; in fact&#44; the sun warm the surface of ocean & land. In the meantime&#44; CERES absolves CO2. Nuclear & natural gas&#44; let’s go!,2023-08-29T22:42:00Z,/tim_dunkerton/status/1696654476915155038#m,6,10,36,0
@brechner,They keep feeding the man-made climate change hoax to every atmospheric phenomenon. Climate change is a natural phenomenon caused by the Sun. Man is not so powerful.   Top 5 reasons Idalia stands apart from other storms axios.com/2023/08/29/hurrica…,2023-08-29T20:32:00Z,/brechner/status/1696621827005776151#m,0,0,1,0
@brechner,Variations in climate are a natural phenomenon caused by the Sun. The man-made climate change hoaxers are making billions of dollars.,2023-08-28T13:52:00Z,/brechner/status/1696158717513748617#m,1,0,0,0
@FrankPi88612261,Yeah shit.  I'm one of these important right wing extremists.  I believe:  The world has natural climate cycles.  That how hot it gets also depends on our circular or elliptical orbits around the sun...how close we get.  ID needed to vote.  Paper ballots.,2023-08-28T02:32:00Z,/FrankPi88612261/status/1695987566292484491#m,1,0,0,0
@MitchKC18,Can anyone say hypocrites. Don’t be fooled by this climate change hoax. Carbon dioxide is a natural compound that all green plants and allergies need and absorb everyday. Yes the climate is always changing due to the sun and earth continuous cycles. The sun causing climate change,2023-08-25T15:48:00Z,/MitchKC18/status/1695100870097330189#m,1,0,0,0
@Badger_8_,Now wait a minute...  Major changes on Neptune are caused by sun cycles but much smaller changes on Earth must be due to human-induced climate change?🤔  kion546.com/news/2023/08/22/….,2023-08-23T11:47:00Z,/Badger_8_/status/1694315504951759328#m,0,0,0,0
@bigshoedrop,Climate: Earth is in the middle of two natural cycles. One is a 40k year tilt of Earth away from the Sun at N pole and towards the Sun at S pole. Next is the 100k year orbit of Earth around the Sun at closest distance. Earth is in the middle of a never experienced climate cycle.,2023-08-23T01:21:00Z,/bigshoedrop/status/1694157872983118116#m,1,0,0,0
@angusreidorg,Two-thirds say climate change is a fact&#44; and human activities are the main cause. One-in-five believe climate change is happening but say it is instead caused by natural cycles.  angusreid.org/canada-record-…,2023-08-22T14:00:00Z,/angusreidorg/status/1693986598172622959#m,1,5,3,1
@FrankPi88612261,And I don't wanna bring marshmallows to every stinking fire the WEF goon squads start to (prove?) that climate change (natural cycles of the earth and The Sun is hot) is a human created condition.,2023-08-14T05:56:00Z,/FrankPi88612261/status/1690965604973314048#m,0,0,0,0
@dspencerlifeX,"Climate change is real. But&#44; it's Natural&#44; in cycles. The entire solar system climate has changed&#44; in the cycle. Humans aren't on the other planets&#44; yet they've experienced similar ""climate change"" as Earth in the same time period. The ""human caused"" part is the hoax.",2023-08-13T05:55:00Z,/dspencerlifeX/status/1690602903193391104#m,0,0,0,0
@westerlaken2,I have seen the climate change from when I was a kid in the 60’s. I don’t know how much of that change is from human consumption of fossil fuels&#44; sun cycle&#44; ocean water temp/current cycles&#44; other weather cycle or something else. That being said this calling everything is caused by Climate Change is utter nonsense.,2023-08-02T20:46:00Z,/westerlaken2/status/1686840856630657024#m,0,1,3,0
@Midlifecrisisw1,"Met someone who works on ""climate change policy"" for a ministry  Me Hasn't been warmer and colder before? She   .... well yes Me   What caused that? She   Natural cycles Me so did they stop and we took over? She No but it is faster now Me how much faster?  She I don't know...",2023-08-02T14:17:00Z,/Midlifecrisisw1/status/1686742999957393409#m,0,0,6,0
@geoffschaeff,You don't allow people to comment to your obviously truthful and irrefutable statements&#44; but show me the data that supports the 120&#44;000 years assertion&#44; and how that relates to human-caused 'global boiling'&#44; rather than natural sun cycles etc.,2023-07-28T21:12:00Z,/geoffschaeff/status/1685035555434659842#m,0,0,0,0
@WalterHudson,Aztec priests leveraged esoteric knowledge of natural cycles&#44; such as eclipses&#44; to make outlandish claims justifying their authority.  'Behold&#44; the Serpeant devours the sun!'  They also engaged in human sacrifice.  Today's climate priests are no different.,2023-07-28T14:30:00Z,/WalterHudson/status/1684934353539985408#m,30,26,134,4
,,,,0,0,0,0
@ClimateTown,Episode 3 of the new podcast is up! Take a listen to the very big brain argument that the sun’s natural cycles are causing climate change - with @NicoleConlan and @RollieWilliams open.spotify.com/episode/1hI…,2023-07-25T19:24:00Z,/ClimateTown/status/1683921203012984836#m,11,5,66,2
@GerryBridgett,They love using a lick of paint and crayons 🖍️ 🖍️ for Gaslighting   @RadioBrendanRTE @DearbhailDibs   Climate change is caused by Axial precession&#44; Apsidal precession and Solar Cycles&#44; not CO2 that comprises 0.04% of gases in the atmosphere of which 90 plus % are   natural,2023-07-23T10:43:00Z,/GerryBridgett/status/1683065341918756865#m,0,0,1,0
@RealAmVoice,The Biden Administration Wants to Block Out The Sun?  @corsijerome1 joins @stevegrubershow to explain how the Biden administration is ignoring natural climate cycles of the earth.  Watch LIVE➡ bit.ly/plutorav  Watch more #SteveGruberShow here: americasvoice.news/video/Kda…,2023-07-20T16:05:00Z,/RealAmVoice/status/1682059148110774276#m,5,13,17,1
@FerretScot,As part of our series on the climate crisis&#44; Ferret Fact Service looks at the claim that natural variations in cycles rule the climate&#44; instead of human activity.   It’s False ❌ bit.ly/3OfIibc,2023-07-19T13:00:00Z,/FerretScot/status/1681650143391543296#m,0,6,3,0
@UnisonDave,A widely repeated suggestion by climate sceptics online is that climate change observed in recent decades is part of a natural cycle of weather that is not linked to human causes.  Fact Check unsurprisingly says this is False. theferret.scot/claim-global-…,2023-07-19T07:04:00Z,/UnisonDave/status/1681560566114942976#m,0,0,2,0
@WildBurdwumman,Claim that climate change is caused by natural cycles not human activity is False theferret.scot/claim-global-… via @ferretscot,2023-07-18T10:02:00Z,/WildBurdwumman/status/1681243087966724096#m,0,0,0,0
@FerretScot,🔴 FACT CHECK: A widely repeated suggestion by climate sceptics online is that climate change observed in recent decades is part of a natural cycle of weather that is not linked to human causes.   The claim is False ❌ bit.ly/3XZiMdp?utm_source=Tw…,2023-07-18T07:00:00Z,/FerretScot/status/1681197160132427776#m,1,19,20,4
@RoyD27112543,Canon of the Earth's Insolation   characterizes the climates of all the planets of the Solar System.  Earth's long-term climate changes caused by changes in the position of the Earth in comparison to the Sun&#44; now known as Milankovitch cycles.,2023-07-18T02:14:00Z,/RoyD27112543/status/1681125273486360576#m,0,0,0,0
@xtp03,Blocking the sun to combat climate change is a dangerous proposition. It ignores the complex&#44; interrelated nature of our planet and the long-term effects. We risk disrupting natural cycles&#44; potentially causing more harm than good. #ClimateCrisis invidious.tiekoetter.com/6SsJZkT0MmU,2023-07-16T18:08:00Z,/xtp03/status/1680640660964282373#m,0,0,1,0
@StevePratico,"Yep.  The biggest factor in ""Climate Change"" or ""Global Warming"" is the ONE THING they cannot control.  The sun. And natural cycles of solar events.  More sun = more WATER VAPOR and clouds in the atmosphere. It's not CO2 that is ""the problem"".  This sounds very simplistic. It is.",2023-07-15T16:33:00Z,/StevePratico/status/1680254380317229056#m,0,0,0,0
@TheRomanoReport,The factors that affect climate are exceedingly complex.  They include sun cycles&#44; changes in the orientation of the Earth and its orbit&#44; and YES&#44; it includes changes in the chemical composition of the atmosphere&#44; both natural and anthropogenic.,2023-07-14T21:13:00Z,/TheRomanoReport/status/1679962300306923521#m,0,1,6,0
@AldnoahVoid,"Polluters cause environmental damages but what RFK Jr. observed from when he was a kid to now is not ""Climate Change"" caused by C02 & methane but a clear indication of the Earth's orbit around the sun & tilt changes...hence climate change is natural!",2023-07-13T00:56:00Z,/AldnoahVoid/status/1679293707751759879#m,1,0,2,0
@NOVAeducation,Yesterday&#44; the Earth was at its furthest point from the sun&#44; known as aphelion. It may seem counterintuitive&#44; especially given the record-breaking heat&#44; but it's true! Learn more about Earth's orbit in this video from NOVA: Polar Extremes. bit.ly/3O3yLDS,2023-07-07T21:49:00Z,/NOVAeducation/status/1677434786699247616#m,0,0,1,0
@samfrob5,An entire field of “bought” science. Many scientists agree that climate change is a natural cycle caused by variations in the orbit of the earth around the sun and not by mankind. In the 70’s we were told we would run out of oil by 2000. Many false predictions.,2023-07-03T07:44:00Z,/samfrob5/status/1675772539866431491#m,2,0,1,0
@Justice_forum,Absolute load of codswallop! 😡  Climate change is a natural phenomenon as the sun and earth progress through various cycles.  Humans are inconsequential in these phases and will never make any difference.,2023-06-29T10:28:00Z,/Justice_forum/status/1674364102683099139#m,12,23,67,4
@bill_summer,Climate change is caused by the movement and seasonal rotation of Earth around the Sun. @NASA #alltrewsonly #ClimateScam #climtards climate.nasa.gov/news/2948/m…,2023-06-25T18:00:00Z,/bill_summer/status/1673028352209461248#m,0,1,0,0
@samfrob5,Too short a time span for climate. Climate is a natural cycle caused by the sun not mankind.,2023-06-17T11:15:00Z,/samfrob5/status/1670027470572011521#m,2,0,0,0
@samfrob5,Why do you say this when it is not true?  Look at the evidence rather than what you have been told. Open your eyes and your brain. Climate change is a natural phenomenon caused by the orbit of the earth around the sun. It is not mankind driven.,2023-06-16T20:57:00Z,/samfrob5/status/1669811472501702656#m,7,0,0,0
@donadon_tobia,Is climate change primarily caused by human activity or natural cycles? #ClimateScience,2023-06-15T17:48:00Z,/donadon_tobia/status/1669401414131433477#m,0,0,0,0
@DominickAlbano3,Wildfires are not caused by climate change&#44; they are part of Earth's natural cycles and are increasingly started by humans. But the conditions that make wildfires more intense and severe are strongly linked to human-induced changes in the climate.  abcnews.go.com/US/canadas-wi…,2023-06-08T18:30:00Z,/DominickAlbano3/status/1666875237328359425#m,0,0,1,0
