user,text,created_at_datetime,link,comments,retweets,likes,quotes
@StephanSabeski,"They have no proof of their wild claims. Many scientists who initially supported the idea of climate change have since admitted that there is no cause for concern. This suggests that the data they analyzed indicated natural climate cycles rather than climate change.  The sun is expanding&#44; Earth's rotation is speeding up&#44; and they are seeding the air with metals. I want to know how much we have reduced our temperature by taxing carbon. They keep telling us it's getting worse&#44; yet Canada has one of the lowest carbon outputs.  They are enforcing a fascist government and system. Soon&#44; there will be factions&#44; and you will be assigned your job within the system. ""The Hunger Games"" is becoming a reality.",2024-05-31T15:47:00Z,/StephanSabeski/status/1796569115358061050#m,0,1,1,0
@djuric_dan5976,Carbon Dioxide is good cos it makes the plants grow&#44; compared to water its a tiny percentage&#44; so climate change is not man made&#44; check out Milankovic sun cycles&#44; its a natural cycle of climate change,2024-05-23T09:53:00Z,/djuric_dan5976/status/1793581085302919570#m,0,0,0,0
@NickSav19185299,THE SUN 🌞 IS ALMOST AT SOLAR MAXIMUM. WHEN THE MOST SUNSPOTS ARE ACTIVE.  THE EFFECTS ON EARTH ARE MORE NOTICEABLE THAN WHEN QUIETER. MEDIA IS RIFE WITH PROPAGANDA ABOUT CHANGING CLIMATE BLAMING HUMANS. NATURAL CYCLES THAT BEGAN BEFORE YOU WERE BORN. HUMANS DONT CONTROL THE SUN.,2024-05-21T11:37:00Z,/NickSav19185299/status/1792882455717851190#m,0,0,0,0
,,,,0,0,0,0
@Mawk109,It's the avoidance of addressing natural cycles&#44; such as the Earth's relationship to the Sun&#44; that makes the climate change debate farcical. The climate policies clearly mask other motives. However&#44; I am for reforestation and getting plastic out of the environment.,2024-05-21T03:15:00Z,/Mawk109/status/1792756061176573998#m,0,0,4,0
@joaquimsacouto,This alternative scientific view suggests that we may be heading for a period of cooler climate as the Earth and Sun go through their natural cycles. If true&#44; this is  no reason to be dismayed because we have the technology to deal with it and survive well through the colder period. Provided&#44; that is&#44; we are not suckered into abandoning that technology. eurekalert.org/news-releases…,2024-05-20T06:19:00Z,/joaquimsacouto/status/1792440098090299582#m,1,0,0,0
@XRUK_Actions,As the climate breaks down&#44; the seasons fracture. Natural cycles dependent on day length or temperature are no longer in sync as Nature’s heartbeat falters.   A trend towards earlier springs has caused problems because…,2024-05-17T13:50:00Z,/XRUK_Actions/status/1791466235248464374#m,4,11,23,1
@CornwallSteward,Gov. Shapiro&#44; PA is thriving! Contrary to popular belief&#44; modest warming isn't caused by CO2&#44; but by natural cycles. NOAA data shows PA's climate has become more benign since 1895&#44; with no change in avg. max. temp. and fewer 100° days. #Pennsylvania.  buff.ly/3yi15wP,2024-05-07T14:27:00Z,/CornwallSteward/status/1787851631561679168#m,0,0,1,0
@esgprouk,FACT: Climate change is caused by human activity Natural changes in the sun’s activity or large volcanic eruptions have caused ancient shifts in the Earth’s temperatures and weather patterns&#44; but over the last 200 years&#44; these natural causes have not significantly affected gl ...,2024-04-29T10:00:00Z,/esgprouk/status/1784885377842508153#m,0,0,0,0
@BlindFaithBook,How well do you think any of these people understand climate science?  Can ONE tell us what percentage of any warming figure they want to give&#44; is caused by humans&#44; & what percentage is caused by natural cycles?,2024-04-21T17:05:00Z,/BlindFaithBook/status/1782093225307836916#m,0,0,0,0
@MissKingsCastle,Whether climate change is caused by Earth Natural Cycles or caused by human impact its still changing.   We still need to look after our Planet and stop depleating its resources so vastly for all future life on Earth after us.  I really don't understand not wanting to do that,2024-04-19T09:40:00Z,/MissKingsCastle/status/1781256483704840482#m,1,0,0,0
@patPreacher81,NOW HERE IS THIS AND GET IT STRAIGHT THERE IS NO SUCH THING AS HUMAN CAUSED CLIMATE CHANGE WE DIDN'T CAUSE IT WE CAN'T STOP IT IT'S CAUSED BY THE SUN AND IT CYCLES   SO HELP THE FARMERS STOP TRYING TO LEGISLATE ALL OF US AND TAX FOLKS TO  DEATH,2024-04-16T10:11:00Z,/patPreacher81/status/1780177285133562037#m,0,0,0,0
@ColinRe12295952,Weather cycles warming and cooling are a natural CYCLE !!!!  STOP CLIMATE LIES NOW !  STOP CHEMTRAIL SUN BLOCKING IMMEDIATELY a few corrupt scientists paid by the people lying is NOT real science ! It’s a crime,2024-04-14T06:03:00Z,/ColinRe12295952/status/1779390028168212530#m,0,0,0,0
@overthis_yngris,Weather anomalies are abnormal weather events that deviate from the usual patterns&#44; such as extreme temperatures&#44; storms&#44; or droughts. They can be caused by various factors like climate change or natural cycles. #WeatherAnomalies,2024-04-13T18:24:00Z,/overthis_yngris/status/1779214092319752534#m,0,0,0,0
@toffis,Unscientific b/s pushed by globalists desperate to link climate & biology&#44; 2 disciplines used as instruments of control. #Climate change is a natural function of the earth & driven by sun cycles & the axis & orbit of the planet not CO2 levels which are currently historically low,2024-04-12T10:31:00Z,/toffis/status/1778732793117172208#m,0,0,0,0
@Tony76513217,Today I learned from the best and brightest #Democrats have to offer that 1. #earthquakes  are caused by climate change 2. #SolarEclipse2024 are caused by Earths #climatechange 3. That #cicadas natural cycles and behavior is caused by climate change. mediaite.com/media/sunny-hos…,2024-04-09T06:46:00Z,/Tony76513217/status/1777588834378653719#m,0,0,0,0
@ChasingWConnor,I am by no means denying climate change&#44; but can we like maybe not artificially change the entire worlds climate and its natural cycles. Also&#44; the sun and the solar radiation it produces  is sorta kinda essential for all life so personally I would rather not have anyone messing with that…,2024-04-05T23:02:00Z,/ChasingWConnor/status/1776384874259124720#m,9,3,58,0
@CanadianPolling,"Agreement with - ""Climate change is a fact and is mostly caused by natural changes and cycles""  All Canadians: 27%  PPC/Others: 51% CPC: 49% BQ: 21% GPC: 18% LPC: 9% NDP: 8%  Angus Reid / March 24&#44; 2024 / n=1602 / Online   338canada.ca/p/why-try-to-re…",2024-04-03T03:51:00Z,/CanadianPolling/status/1775370500375503154#m,29,14,116,9
@maegan_laporte,Yes climate changes are real but are caused by the sun ocean cycles etc not driving vehicles and human co2 is minimal compared to nature and fyi co2 is our friend and helps plants grow its it not pollution there in lies the scam,2024-04-01T20:07:00Z,/maegan_laporte/status/1774891256147026412#m,0,0,0,0
@wamcgill,It is clear that climate is always changing since the earth's origin. And these changes&#44; are very well recognized in cycles caused by the Sun&#44; Clouds&#44; Stars and Oceans. The question is whether the human activities are significant enough to make a difference.,2024-03-31T15:51:00Z,/wamcgill/status/1774464446435377542#m,0,0,0,0
@esgprouk,FACT: Climate change is caused by human activity Natural changes in the sun’s activity or large volcanic eruptions have caused ancient shifts in the Earth’s temperatures and weather patterns&#44; but over the last 200 years&#44; these natural causes have not significantly affected gl ...,2024-03-29T11:00:00Z,/esgprouk/status/1773666576270516523#m,0,0,0,0
@ddx232,So let me get this right&#44; according to the current day experts&#44; heart disease is caused by: - eating whole&#44; natural&#44; ancestral foods - getting some sun - not eating continuously while awake - climate change,2024-03-28T15:03:00Z,/ddx232/status/1773365269777224038#m,1,0,2,1
@madz210209,"""Sunspots: Windows into Solar Activity"" Sunspots are temporary dark patches on the Sun's surface caused by intense magnetic activity. This article examines the formation and characteristics of sunspots&#44; their role in solar cycles&#44; and their impact on Earth's climate and technology.",2024-03-27T06:15:00Z,/madz210209/status/1772870003043565986#m,16,0,0,0
@baustinjr,Climate alarmist will not talk about history.They just want you to believe what they say and hope don't look into it.Chris does a great Job identifying truth and real data&#44;history can't be denied! Patterns repeat and the atmosphere goes through natural cycles!The sun controls us!,2024-03-27T01:59:00Z,/baustinjr/status/1772805656355201046#m,0,0,1,0
,,,,0,0,0,0
@SYekalis,Climate the Movie 🎥 (The natural changes in our sun's own cycles still provide the significant changes in our weather & climate)<^> invidious.tiekoetter.com/p4vSMj4R5Rg?si=iItM…,2024-03-24T09:31:00Z,/SYekalis/status/1771832186821357792#m,0,0,0,0
@jedishaman,The CO2 climate change deception is increasingly being challenged by independent scientists. Climate change is driven by the Sun & natural cycles&#44; & limiting CO2 emissions won't change what the Sun & Earth are doing or remove the necessity of adaptation.  vimeo.com/924719370,2024-03-23T12:51:00Z,/jedishaman/status/1771520091676381640#m,0,0,0,0
@samfrob5,Absolutely. Climate change is natural and caused mainly by slight variations in the orbit of the earth around the sun. 🇬🇧🇬🇧🇬🇧🇬🇧,2024-03-19T17:51:00Z,/samfrob5/status/1770146025879003173#m,0,1,1,0
@fox28columbus,If it's true that Mars has an impact on our oceans&#44; then it could help scientists better understand the natural climate cycles that our planet goes through. bit.ly/3TPPJJ7,2024-03-18T18:30:00Z,/fox28columbus/status/1769793416454427086#m,0,0,0,0
@wsyx6,If it's true that Mars has an impact on our oceans&#44; then it could help scientists better understand the natural climate cycles that our planet goes through. bit.ly/3TPPJJ7,2024-03-18T18:00:00Z,/wsyx6/status/1769785909354930577#m,0,0,0,0
@DrMarkDHamilton,PLEASE for the love of HUMANITY share this w your brainwashed kids #ClimateScam  CO2 is CAUSED by 🌎NATURAL CLIMATE CHANGE It is not caused by MAN/OIL/CAPITALISM- it was USSR disinfo 1956 CHANGE is caused mostly by🌞CYCLES then by 🌊OCEAN CURRENTS then by 🌋Land & Sea activity,2024-03-18T17:29:00Z,/DrMarkDHamilton/status/1769778091692294529#m,0,0,0,0
@samfrob5,Simply madness. Climate change is natural caused by natural changes in the orbit of the earth around the sun.,2024-03-16T21:51:00Z,/samfrob5/status/1769119424798134673#m,0,0,1,0
@quark4511,We have been saying it all along:  Climate Alarmism is the biggest hoax ever perpetrated on humankind.  Climate change has occurred for more than 500 million years&#44; long before humans were driving Suburbans.  It is caused by Milankovitch Cycles and the Sun's output.  ALL their CO2 crap is bullshit to tax you and control you.  canadafreepress.com/article/…,2024-02-23T16:35:00Z,/quark4511/status/1761067309014335875#m,0,0,0,0
@AerosolizeX,And we're honestly lead to believe that the world is getting hotter and hotter.  Absolute clowns. All signs are pointing to a colder future this Century onwards due to natural variability climate cycles caused by many factors&#44; such as the the Earth's geomagnetic shift of its Poles&#44; the Moon and Sun and the gas giants of our Solar System.  All these people can blame is CO2 increase causing linear greenhouse gas warming of the Earth.  We need CO2 for sustainable biodiversity.,2024-02-20T23:38:00Z,/AerosolizeX/status/1760086666432106691#m,0,0,0,0
@PrivateerX,This entire narrative is based on the heliocentric climate change caused by the sun.   We are already seeing evidence of the poles shifting and accelerating as well as increases in volcanic activity.   Sun spot cycles directly correlate with the rise and fall of empires.,2024-02-20T20:32:00Z,/PrivateerX/status/1760039789821124959#m,0,0,0,0
@GuruPundit,What causes natural cycles of climate change? The sun? The ocean? Your commute to work? If it weren’t for climate change&#44; we’d still be living in an ice age…,2024-02-18T12:03:00Z,/GuruPundit/status/1759186976291385555#m,0,0,2,1
@BkennedyBarbara,⬇️⬇️ poor canoe boy denies the truth.  CO2 and carbon tax do not control climate-tho looks like they make for profitable liberal grifting-; sun&#44; natural cycles and random events do.  No researcher has ever proven the hypothesis that atmospheric CO2 impacts climate.,2024-02-15T14:41:00Z,/BkennedyBarbara/status/1758139418446336498#m,0,0,0,0
@ECOWARRIORSS,A little light reading for sensitive deniers  Why current climate change is not natural but man made  Its not the Sun  Its not Volcanoes   Its not El Nino   Its not orbital cycles  Its not cosmic rays?  Its man made from burning of fossil fuels to mass deforestation,2024-02-07T02:16:00Z,/ECOWARRIORSS/status/1755052820431003709#m,0,7,10,0
@Barkum68,Co2 is a good gas. It is food for trees&#44; shrubs and plants. CO2 reduction is murder of nature. Only 3 to 5% of climate change is caused by humans&#44; the rest is caused by the sun&#44; cosmic rays and the earth itself. It is a natural process we just need to adjust.,2024-02-04T21:55:00Z,/Barkum68/status/1754262423790391524#m,0,0,0,1
@SScriver3,"No ""druds "" or anything&#44; all natural climate cycles; long and short; CYCLES; some  hot some  cold. Pier reviewed science data has been around many decades before  you were ever born! The Sun is the prime driver. You are not. Scientists but you are a politicized globalist puppet!",2024-02-04T21:42:00Z,/SScriver3/status/1754259273670889777#m,0,0,1,0
@PhlabaLaban,The ICE AGE is moving back from the poles and it's not global warming and it's a natural cycle of the earth caused by the earth TILTING on its AXIS PULLING on the SUN'S gravitational field really HARD causing the SUN to OVERHEAT&#44; and overheating earth   euronews.com/next/2024/01/29…,2024-01-30T13:25:00Z,/PhlabaLaban/status/1752322115510907207#m,0,0,0,0
@Clarsonimus,#ClimateCrisis Fun Facts: The Svensmark Mechanism (see cosmoclimatology) is a natural #climate fluctuation mechanism. It is caused by cosmic rays associated with fluctuations in the sun's electromagnetic field that have an influence on cloud cover.  #CO2 #Fear #Business,2024-01-29T15:32:00Z,/Clarsonimus/status/1751991593156972584#m,0,1,6,0
@WoltzHowell,For those who were not alive in the 1970s&#44; we were taught that we would be living in igloos and an ice age by the year 2000.  They knowingly lied then&#44; as they are now.  Climate cycles are caused by the sun&#44; not man&#44; and CO2 has absolutely nothing to do with it.,2024-01-16T10:14:00Z,/WoltzHowell/status/1747200533054599586#m,0,0,0,0
@sixthtimelucky6,This is what happens with “Man Made Climate Change” when you cloud seed to produce rain and spray chemicals in the sky to block the Sun of course it’s going to affect natural weather cycles!!!,2024-01-05T12:55:00Z,/sixthtimelucky6/status/1743254790363115715#m,1,0,1,0
@BrettHardwood,Wake up Canadians. @JustinTrudeau has done this to you over natural climate cycles not caused by humans,2023-12-30T21:50:00Z,/BrettHardwood/status/1741215114114830545#m,0,0,0,0
,,,,0,0,0,0
@GrahamLKeegan,The climate changes.   When it comes down to the basics&#44; a changing climate can be caused by either:  1. A trace gas&#44; CO2 - the gas of life&#44; 96% is natural; or&#44; 2. Our Sun that is 330&#44;000 times the mass of the Earth&#44; a ball of hot plasma with energy from nuclear fusion.  Let me have a think about this.,2023-12-26T10:42:00Z,/GrahamLKeegan/status/1739597601819738167#m,4,7,35,0
@LeftistBasher,You see how stupid this climate shit is?  The past ice melt was caused by “Natural cycles”.  Apparently&#44; those cycles stopped and now everything is man made. 🤯 😂😂😂😂,2023-12-22T18:44:00Z,/LeftistBasher/status/1738269179155726758#m,1,0,1,0
@Inversionism,Yet another coronal mass ejection in conjunction with the eruption of volcanoes and earthquakes.   This simply demonstrates why all the human caused climate change narratives are complete and total nonsense&#44; showing how much of an impact the sun has on the earth&#44; natural disasters&#44; and our general climate and environment.,2023-12-19T03:06:00Z,/Inversionism/status/1736946071178223866#m,13,62,284,3
@Lone_Candle,"""in 2023&#44; there were several natural forces converging on top of human-caused warming pushing up temperatures around the world...temperature cycles in the Atlantic Ocean and the El Niño pattern in the Pacific Ocean converged in their hot phases this year""  vox.com/23969523/climate-cha…",2023-12-10T15:14:00Z,/Lone_Candle/status/1733867748462068195#m,0,0,0,0
@Nevrdemagain,Just like the Climate related mental health crisis. I love how they never include natural processes that are contributing to the changing climate. Volcanism and Sun cycles are never mentioned. Then they say it hasn't ever been this hot in 150 years like that's how old the earth is. Its such a scam.,2023-12-04T18:37:00Z,/Nevrdemagain/status/1731744437427183959#m,0,0,1,0
@opinion_potato,Is climate change primarily caused by human activities or natural cycles?  opinionpotato.com/poll/67348… #ClimateChange,2023-12-04T18:02:00Z,/opinion_potato/status/1731735661743378588#m,0,0,0,0
@daveycrocket21,The climate changes every day. So yes climate change and changing from warm to cold climate crisis&#44; global warming is natural caused by the sun's changes. The notion of climate crisis is a scam in my view taken from overwhelming scientific evidence,2023-12-02T23:44:00Z,/daveycrocket21/status/1731096956288516370#m,0,0,0,0
@Longboarder_uk,Climate change is real&#44; as it has been for millennia&#44; it’s not caused by humans&#44; but the sun and it’s cycles&#44; the cycles of the galactic current sheet . There is no stopping what is coming&#44; like what has happened in the past&#44; regardless of what the #parasiteclass tells you.,2023-11-26T10:28:00Z,/Longboarder_uk/status/1728722442636406833#m,0,1,1,0
@ErikMagnethi,The Sun's cycles created climate variations way before industrialisation&#44; just like the warming period we are in now&#44; fully natural&#44; and there is nothing you can do or should do about it - just enjoy😎,2023-11-17T15:10:00Z,/ErikMagnethi/status/1725531889023262949#m,3,1,2,0
@T_Rose_Freedom,🌹Kerry CANNOT be trusted over boat stories & just got new scam to push  TRUE SCIENTISTS ON Global Climate PANEL 🔥🔥🔥REFUTE🔥🔥🔥 They Said POLITICIANS ran away with DATA Cherry🍒picked some To create GLOBAL SCAM  Sun Star has natural cycles & instrument past data is a guess🤡,2023-11-13T18:38:00Z,/T_Rose_Freedom/status/1724134616422903955#m,0,2,0,0
@JunkScience,"El Niño and other natural factors are responsible for the unusual weather in 2023 but WaPo @matthewcappucci can't give up the emissions-driven climate hoax:  ""Rising ocean temperatures because of human-caused climate change.""  Oceans are essentially entirely warmed by the Sun and geothermal heating -- not the atmosphere&#44; which only warms the top millimeter or two.  washingtonpost.com/weather/2…",2023-11-12T15:41:00Z,/JunkScience/status/1723727765185159579#m,15,42,124,0
@CatVanBeest,No  @JustinTrudeau  we’re not afraid of climate change&#44; it happens every day! It’s always changing!  Between the Sun and it’s solar maximum&#44; the earth and its natural environmental cycles&#44; and the axis of the earth which is wobbling more now than we realized&#44; Canada is indeed becoming warmer. We can not alter these things&#44; they happen whether we’re here or not and no amount of taxes or reduction in fossil fuels is going to change that.   So stop with your nonsense rhetoric&#44; stop putting Canadians in debt because you think it’s best. It’s not&#44; you’re just making it easier for China to take over. #cdnpoli #TrudeauMustGo nitter.tiekoetter.com/disclosetv/statu…,2023-11-08T22:19:00Z,/CatVanBeest/status/1722378236506587381#m,1,1,6,0
@peter_beardshaw,Climate this&#44; climate that. The sun has it's own natural cycle The earth has it's own natural cycle Imagine thinking that anything we do can change either of those cycles. Net Zero BS. Wait till peeps see what's coming for Absolute Zero I'll keep posting it for all to see.😇🤔,2023-11-07T07:52:00Z,/peter_beardshaw/status/1721797738382184499#m,0,1,2,0
@joeyab,Sun energy cycles affect our climate more than anything else. The design of earth is pure genius in how its natural systems moderate all extremes.,2023-11-06T09:52:00Z,/joeyab/status/1721465670615826448#m,0,0,1,0
@Global_Witness,"""Rather than racing to extract natural gas&#44; those who caused the climate crisis should help Africa harness its wind and sun""   Climate justice activist @vanessa_vash speaks on the surge of interest in Africa as a new gas source  gwitness.org/3u47WYD",2023-11-01T16:00:00Z,/Global_Witness/status/1719746208845922347#m,0,3,10,0
@AFRICASeenHeard,Rich countries should stop pushing fossil fuels on Africa – don’t we deserve a renewable future too? | Vanessa Nakate  Rather than racing to extract natural gas&#44; those who caused the climate crisis should help Africa harness its wind and sun   theguardian.com/commentisfre…,2023-10-30T21:48:00Z,/AFRICASeenHeard/status/1719109098384363785#m,0,0,0,0
@tveitdal,Rich countries should stop pushing fossil fuels on Africa – don’t we deserve a renewable future too? | Vanessa Nakate  theguardian.com/commentisfre…  Rather than racing to extract natural gas&#44; those who caused the climate crisis should help Africa harness its wind and sun  @vanessa_vash is a Unicef goodwill ambassador and youth climate activist,2023-10-30T14:25:00Z,/tveitdal/status/1718997610873106771#m,8,14,43,1
@polsocteacher,#opinion   Rather than racing to extract natural gas&#44; those who caused the climate crisis should help Africa harness its wind and sun  theguardian.com/commentisfre…,2023-10-27T22:46:00Z,/polsocteacher/status/1718036516792856809#m,0,0,1,0
@BasuAshis,Rich countries should stop pushing fossil fuels on Africa – don’t we deserve a renewable future too?   “Rather than racing to extract natural gas&#44; those who caused the climate crisis should help Africa harness its wind and sun” @vanessa_vash theguardian.com/commentisfre…,2023-10-27T13:08:00Z,/BasuAshis/status/1717891029259485517#m,0,11,34,0
@evanlgeorge,At a 2017 townhall&#44; Mike Johnson said: “The climate is changing&#44; but the question is&#44; is it being caused by natural cycles over the span of the Earth’s history? Or is it changing because we drive S.U.V.s? I don’t believe in the latter. I don’t think that’s the primary driver.”,2023-10-26T21:45:00Z,/evanlgeorge/status/1717658657113170352#m,0,0,0,0
,,,,0,0,0,0
@PhilipJ_backman,Here's next speaker candidate Mike Johnson on the climate crisis: “The climate is changing&#44; but the question is&#44; is it being caused by  natural cycles over the span of the Earth’s history? Or is it changing  because we drive SUVs? I don’t believe in the latter.” Awesome.,2023-10-26T19:24:00Z,/PhilipJ_backman/status/1717623299520262530#m,0,0,1,0
@TomANelson,Nice!   New House @SpeakerJohnson 2017: “I am not a proponent of climate change because I have seen data on the other side&#44;” he said. “The climate is changing&#44; but the question is&#44; is it being caused by natural cycles over the span of the Earth’s history or is it changing because we drive SUVs? I don’t believe in the latter. I don’t think that's the primary driver.”,2023-10-26T15:27:00Z,/TomANelson/status/1717563708421931161#m,20,76,285,3
@LCVoters,"“The climate is changing&#44; but the question is&#44; is it being caused by natural cycles over the span of the Earth’s history? Or is it changing because we drive SUVs? I don’t believe in the latter.""  -@SpeakerJohnson",2023-10-26T14:59:00Z,/LCVoters/status/1717556462107439211#m,2,0,6,1
@RonBrownstein,"At a town hall&#44;Johnson said: “The climate is changing&#44; but the ? is&#44; is it being caused by natural cycles over the span of the Earth’s history? Or is it changing b/c we drive S.U.V.s? I don’t believe in the latter. I don’t think that’s the primary driver"" nytimes.com/2023/10/26/clima…",2023-10-26T14:54:00Z,/RonBrownstein/status/1717555184824709554#m,6,9,12,2
@JohnSurico,“The climate is changing&#44; but the question is&#44; is it being caused by natural cycles over the span of the Earth’s history? Or is it changing because we drive S.U.V.s? I don’t believe in the latter. I don’t think that’s the primary driver.”  nytimes.com/2023/10/26/clima…,2023-10-26T14:50:00Z,/JohnSurico/status/1717554279785890086#m,1,1,0,0
@NobleIdeas,Speaker Mike Johnson&#44; 2017:  “The climate is changing&#44; but the question is&#44; is it being caused by natural cycles over the span of the Earth’s history? Or is it changing because we drive SUVs? I don’t believe in the latter. I don’t think that’s the primary driver.”   #Climate,2023-10-26T11:51:00Z,/NobleIdeas/status/1717509323520176602#m,2,0,2,1
@safe_climate,"New Speaker is a #climate denier: “The climate is changing&#44; but the question is&#44; is it being caused by natural cycles over the span of the Earth’s history? Or is it changing because we drive SUVs? I don’t believe in the latter."" @Emma_Dumain @kelseybrugger eenews.net/articles/mike-joh…",2023-10-25T19:39:00Z,/safe_climate/status/1717264521708908790#m,1,1,1,0
@LCVoters,"“The climate is changing&#44; but the question is&#44; is it being caused by natural cycles over the span of the Earth’s history? Or is it changing because we drive SUVs? I don’t believe in the latter.""  -Republicans' new MAGA House Speaker @RepMikeJohnson eenews.net/articles/mike-joh…",2023-10-25T18:30:00Z,/LCVoters/status/1717247169483149705#m,0,0,1,0
